{
  "$schema": "https://json-schema.org/draft/2020-12/schema",
  "$id": "https://github.com/seunghyeon1004/claude-code-skillsets/schemas/v3/routing-index.schema.json",
  "title": "DecisionRoutingIndex",
  "type": "object",
  "additionalProperties": false,
  "required": [
    "schemaVersion",
    "catalogVersion",
    "observedThrough",
    "catalogExpiresAt",
    "profiles",
    "decisionIndexDigest",
    "digest"
  ],
  "properties": {
    "schemaVersion": { "const": 1 },
    "catalogVersion": { "$ref": "#/$defs/sha256" },
    "observedThrough": { "type": "string", "minLength": 1 },
    "catalogExpiresAt": { "type": "string", "minLength": 1 },
    "profiles": {
      "type": "array",
      "minItems": 1,
      "items": { "$ref": "#/$defs/profile" }
    },
    "decisionIndexDigest": { "$ref": "#/$defs/sha256" },
    "digest": { "$ref": "#/$defs/sha256" }
  },
  "$defs": {
    "id": {
      "type": "string",
      "pattern": "^[a-z0-9]+(?:-[a-z0-9]+)*$"
    },
    "sha256": {
      "type": "string",
      "pattern": "^[a-f0-9]{64}$"
    },
    "profile": {
      "type": "object",
      "additionalProperties": false,
      "required": ["id", "domainId", "phrases", "coreCapabilityId", "requiredCapabilityIds"],
      "properties": {
        "id": { "$ref": "#/$defs/id" },
        "domainId": { "$ref": "#/$defs/id" },
        "phrases": {
          "type": "object",
          "additionalProperties": false,
          "required": ["ko", "en"],
          "properties": {
            "ko": {
              "type": "array",
              "minItems": 1,
              "uniqueItems": true,
              "items": { "type": "string", "minLength": 1 }
            },
            "en": {
              "type": "array",
              "minItems": 1,
              "uniqueItems": true,
              "items": { "type": "string", "minLength": 1 }
            }
          }
        },
        "coreCapabilityId": { "$ref": "#/$defs/id" },
        "requiredCapabilityIds": {
          "type": "array",
          "minItems": 1,
          "maxItems": 3,
          "uniqueItems": true,
          "items": { "$ref": "#/$defs/id" }
        }
      }
    }
  }
}
